{
  "version": "0.1.0",
  "status": "prepared_baseline",
  "interview_id": "BA-SA-INT-2026-001",
  "session_id": "BA-SA-RUN-2026-001",
  "data_class": "confidential",
  "raw_answer_policy": {
    "raw_answer_field_forbidden": true,
    "required_safe_summary": true,
    "required_claim_metadata": true
  },
  "answers": [
    {
      "answer_id": "BASA-ANS-001",
      "question_id": "BASA-Q001",
      "domain": "stakeholders",
      "raw_answer_ref": "not_captured:BASA-ANS-001",
      "safe_summary": "Product Owner принимает решение о приоритете, Security/Privacy Lead проверяет границы доверия, Development Team реализует только утвержденный scope.",
      "data_class": "internal",
      "sensitive_flags": ["none"],
      "redaction_status": "not_required",
      "confirmation_status": "confirmed",
      "evidence_refs": ["docs/product/README.md", "docs/process/current/definition-of-ready.md"],
      "allowed_downstream_use": ["claim_extraction", "artifact_generation", "acceptance_gate"]
    },
    {
      "answer_id": "BASA-ANS-002",
      "question_id": "BASA-Q002",
      "domain": "current_process",
      "raw_answer_ref": "not_captured:BASA-ANS-002",
      "safe_summary": "Существующий контур уже разделяет product, process, architecture, schemas, scripts и generated artifacts; новый interview flow должен использовать это разделение.",
      "data_class": "internal",
      "sensitive_flags": ["none"],
      "redaction_status": "not_required",
      "confirmation_status": "confirmed",
      "evidence_refs": ["AGENTS.md", "docs/navigation/navigation-source.json"],
      "allowed_downstream_use": ["claim_extraction", "artifact_generation", "acceptance_gate"]
    },
    {
      "answer_id": "BASA-ANS-003",
      "question_id": "BASA-Q003",
      "domain": "target_outcome",
      "raw_answer_ref": "not_captured:BASA-ANS-003",
      "safe_summary": "Целевой результат: повторяемая фабрика БА/СА артефактов, которая сохраняет trust status и создает проверяемый Change Order.",
      "data_class": "internal",
      "sensitive_flags": ["none"],
      "redaction_status": "not_required",
      "confirmation_status": "confirmed",
      "evidence_refs": ["docs/plans/datacanvas-ba-sa-interview-change-order-implementation-plan.md"],
      "allowed_downstream_use": ["claim_extraction", "artifact_generation", "acceptance_gate"]
    },
    {
      "answer_id": "BASA-ANS-004",
      "question_id": "BASA-Q004",
      "domain": "value",
      "raw_answer_ref": "not_captured:BASA-ANS-004",
      "safe_summary": "A2A-first запуск повышает приоритет машинного запуска презентации, но не отменяет запуск из Лисы как второй продуктовый путь.",
      "data_class": "internal",
      "sensitive_flags": ["none"],
      "redaction_status": "not_required",
      "confirmation_status": "confirmed",
      "evidence_refs": ["docs/product/change-orders/co-2026-001-a2a-first-priority.json"],
      "allowed_downstream_use": ["claim_extraction", "artifact_generation", "acceptance_gate"]
    },
    {
      "answer_id": "BASA-ANS-005",
      "question_id": "BASA-Q005",
      "domain": "constraints",
      "raw_answer_ref": "not_captured:BASA-ANS-005",
      "safe_summary": "Live network, MCP, provider и tool allowlist не расширяются без accepted ADR/PCR и отдельного approval.",
      "data_class": "internal",
      "sensitive_flags": ["security_sensitive"],
      "redaction_status": "not_required",
      "confirmation_status": "confirmed",
      "evidence_refs": ["docs/architecture/security/no-network-by-default.md", "docs/architecture/llm/provider-allowlist.json"],
      "allowed_downstream_use": ["claim_extraction", "artifact_generation", "acceptance_gate"]
    },
    {
      "answer_id": "BASA-ANS-006",
      "question_id": "BASA-Q006",
      "domain": "policies",
      "raw_answer_ref": "not_captured:BASA-ANS-006",
      "safe_summary": "DoR должен требовать interview evidence или явное решение, что интервью не требуется; DoD должен требовать закрытые или отложенные evidence requests.",
      "data_class": "internal",
      "sensitive_flags": ["none"],
      "redaction_status": "not_required",
      "confirmation_status": "confirmed",
      "evidence_refs": ["docs/process/current/definition-of-ready.md", "docs/process/current/definition-of-done.md"],
      "allowed_downstream_use": ["claim_extraction", "artifact_generation", "acceptance_gate"]
    },
    {
      "answer_id": "BASA-ANS-007",
      "question_id": "BASA-Q007",
      "domain": "exceptions",
      "raw_answer_ref": "not_captured:BASA-ANS-007",
      "safe_summary": "Недостаточный input, недоверенный upstream payload и противоречие с Vision/BMC/BT не перезаписывают источник истины, а создают clarification или open decision.",
      "data_class": "internal",
      "sensitive_flags": ["security_sensitive"],
      "redaction_status": "not_required",
      "confirmation_status": "confirmed",
      "evidence_refs": ["docs/architecture/security/trust-boundaries.md", "docs/product/requirements/acceptance-criteria.md"],
      "allowed_downstream_use": ["claim_extraction", "artifact_generation", "acceptance_gate"]
    },
    {
      "answer_id": "BASA-ANS-008",
      "question_id": "BASA-Q008",
      "domain": "channels",
      "raw_answer_ref": "not_captured:BASA-ANS-008",
      "safe_summary": "Email, chat и callback остаются channel decisions; channel-sensitive требования должны быть channel-neutral до принятого решения.",
      "data_class": "internal",
      "sensitive_flags": ["none"],
      "redaction_status": "not_required",
      "confirmation_status": "unconfirmed",
      "evidence_refs": [],
      "allowed_downstream_use": ["evidence_request", "hypothesis_backlog"]
    },
    {
      "answer_id": "BASA-ANS-009",
      "question_id": "BASA-Q009",
      "domain": "data",
      "raw_answer_ref": "not_captured:BASA-ANS-009",
      "safe_summary": "Interview runtime state и answer set являются confidential; generated specs используют только internal safe context.",
      "data_class": "confidential",
      "sensitive_flags": ["commercial_sensitive"],
      "redaction_status": "metadata_only",
      "confirmation_status": "confirmed",
      "evidence_refs": ["docs/architecture/security/data-classification-policy.md", "docs/architecture/security/data-leakage-manifest.json"],
      "allowed_downstream_use": ["claim_extraction", "artifact_generation", "acceptance_gate"]
    },
    {
      "answer_id": "BASA-ANS-010",
      "question_id": "BASA-Q010",
      "domain": "decision_roles",
      "raw_answer_ref": "not_captured:BASA-ANS-010",
      "safe_summary": "Product Owner утверждает Product Change Order; Process Owner решает PCR; Security/Privacy Lead проверяет boundary impact.",
      "data_class": "internal",
      "sensitive_flags": ["none"],
      "redaction_status": "not_required",
      "confirmation_status": "confirmed",
      "evidence_refs": ["docs/product/change-orders/product-change-order-ledger.json", "docs/process/current/process-change-ledger.json"],
      "allowed_downstream_use": ["claim_extraction", "artifact_generation", "acceptance_gate"]
    },
    {
      "answer_id": "BASA-ANS-011",
      "question_id": "BASA-Q011",
      "domain": "acceptance_examples",
      "raw_answer_ref": "not_captured:BASA-ANS-011",
      "safe_summary": "Acceptance должен покрыть launch, insufficient input, approval gate, conflicting sources, sanitized delivery metadata и regeneration trace.",
      "data_class": "internal",
      "sensitive_flags": ["none"],
      "redaction_status": "not_required",
      "confirmation_status": "confirmed",
      "evidence_refs": ["docs/product/analysis/ba/acceptance-delta.md", "docs/product/analysis/ba-sa/interview-derived-coverage.json"],
      "allowed_downstream_use": ["claim_extraction", "artifact_generation", "acceptance_gate"]
    },
    {
      "answer_id": "BASA-ANS-012",
      "question_id": "BASA-Q012",
      "domain": "risks",
      "raw_answer_ref": "not_captured:BASA-ANS-012",
      "safe_summary": "A2A/MCP payloads, tool descriptions и upstream agent output считаются недоверенными данными.",
      "data_class": "internal",
      "sensitive_flags": ["security_sensitive"],
      "redaction_status": "not_required",
      "confirmation_status": "confirmed",
      "evidence_refs": ["docs/architecture/security/trust-boundaries.md", "docs/architecture/security/integration-boundary-matrix.json"],
      "allowed_downstream_use": ["claim_extraction", "artifact_generation", "acceptance_gate"]
    },
    {
      "answer_id": "BASA-ANS-013",
      "question_id": "BASA-Q013",
      "domain": "metrics",
      "raw_answer_ref": "not_captured:BASA-ANS-013",
      "safe_summary": "Run ledger должен фиксировать run_id, command, input paths, output paths, duration, exit code и redacted log hash.",
      "data_class": "internal",
      "sensitive_flags": ["none"],
      "redaction_status": "not_required",
      "confirmation_status": "confirmed",
      "evidence_refs": ["docs/architecture/observability/process-run-ledger.json"],
      "allowed_downstream_use": ["claim_extraction", "artifact_generation", "acceptance_gate"]
    },
    {
      "answer_id": "BASA-ANS-014",
      "question_id": "BASA-Q014",
      "domain": "rollback",
      "raw_answer_ref": "not_captured:BASA-ANS-014",
      "safe_summary": "Rollback возвращает прежний priority order, удаляет generated spec package и повторяет validators без включения live integrations.",
      "data_class": "internal",
      "sensitive_flags": ["none"],
      "redaction_status": "not_required",
      "confirmation_status": "assumption",
      "evidence_refs": [],
      "allowed_downstream_use": ["hypothesis_backlog"]
    }
  ]
}
